,_id,index,name,desc,higher_level,range,components,material,ritual,duration,concentration,casting_time,level,attack_type,damage,school,classes,subclasses,url,dc,heal_at_slot_level,area_of_effect
311,5f2329b00b1bb138c5941540,water-walk,Water Walk,"['This spell grants the ability to move across any liquid surface--such as water, acid, mud, snow, quicksand, or lava--as if it were harmless solid ground (creatures crossing molten lava can still take damage from the heat). Up to ten willing creatures you can see within range gain this ability for the duration.', 'If you target a creature submerged in a liquid, the spell carries the target to the surface of the liquid at a rate of 60 feet per round.']",,30 feet,"['V', 'S', 'M']",A piece of cork.,True,1 hour,False,1 action,3,,,"{'name': 'Transmutation', 'url': '/api/magic-schools/transmutation'}","[{'name': 'Cleric', 'url': '/api/classes/cleric'}, {'name': 'Druid', 'url': '/api/classes/druid'}, {'name': 'Ranger', 'url': '/api/classes/ranger'}, {'name': 'Sorcerer', 'url': '/api/classes/sorcerer'}]","[{'name': 'Lore', 'url': '/api/subclasses/lore'}, {'name': 'Land', 'url': '/api/subclasses/land'}]",/api/spells/water-walk,,,
312,5f2329b00b1bb138c5941541,web,Web,"['You conjure a mass of thick, sticky webbing at a point of your choice within range. The webs fill a 20-foot cube from that point for the duration. The webs are difficult terrain and lightly obscure their area.', ""If the webs aren't anchored between two solid masses (such as walls or trees) or layered across a floor, wall, or ceiling, the conjured web collapses on itself, and the spell ends at the start of your next turn. Webs layered over a flat surface have a depth of 5 feet."", 'Each creature that starts its turn in the webs or that enters them during its turn must make a dexterity saving throw. On a failed save, the creature is restrained as long as it remains in the webs or until it breaks free.', 'A creature restrained by the webs can use its action to make a Strength check against your spell save DC. If it succeeds, it is no longer restrained.', 'The webs are flammable. Any 5-foot cube of webs exposed to fire burns away in 1 round, dealing 2d4 fire damage to any creature that starts its turn in the fire.']",,60 feet,"['V', 'S', 'M']",A bit of spiderweb.,False,Up to 1 hour,True,1 action,2,,,"{'name': 'Conjuration', 'url': '/api/magic-schools/conjuration'}","[{'name': 'Sorcerer', 'url': '/api/classes/sorcerer'}, {'name': 'Wizard', 'url': '/api/classes/wizard'}]","[{'name': 'Lore', 'url': '/api/subclasses/lore'}, {'name': 'Land', 'url': '/api/subclasses/land'}]",/api/spells/web,,,"{'type': 'cube', 'size': 20}"
313,5f2329b00b1bb138c5941542,weird,Weird,"[""Drawing on the deepest fears of a group of creatures, you create illusory creatures in their minds, visible only to them. Each creature in a 30-foot-radius sphere centered on a point of your choice within range must make a wisdom saving throw. On a failed save, a creature becomes frightened for the duration. The illusion calls on the creature's deepest fears, manifesting its worst nightmares as an implacable threat. At the start of each of the frightened creature's turns, it must succeed on a wisdom saving throw or take 4 d10 psychic damage. On a successful save, the spell ends for that creature.""]",,120 feet,"['V', 'S']",,False,Up to 1 minute,True,1 action,9,,,"{'name': 'Illusion', 'url': '/api/magic-schools/illusion'}","[{'name': 'Wizard', 'url': '/api/classes/wizard'}]",[],/api/spells/weird,"{'dc_type': {'name': 'WIS', 'url': '/api/ability-scores/wis'}, 'dc_success': 'none'}",,"{'type': 'sphere', 'size': 30}"
314,5f2329b00b1bb138c5941543,wind-walk,Wind Walk,"[""You and up to ten willing creatures you can see within range assume a gaseous form for the duration, appearing as wisps of cloud. While in this cloud form, a creature has a flying speed of 300 feet and has resistance to damage from nonmagical weapons. The only actions a creature can take in this form are the Dash action or to revert to its normal form. Reverting takes 1 minute, during which time a creature is incapacitated and can't move. Until the spell ends, a creature can revert to cloud form, which also requires the 1-minute transformation."", ""If a creature is in cloud form and flying when the effect ends, the creature descends 60 feet per round for 1 minute until it lands, which it does safely. If it can't land after 1 minute, the creature falls the remaining distance.""]",,30 feet,"['V', 'S', 'M']",Fire and holy water.,False,8 hours,False,1 minute,6,,,"{'name': 'Transmutation', 'url': '/api/magic-schools/transmutation'}","[{'name': 'Druid', 'url': '/api/classes/druid'}]",[],/api/spells/wind-walk,,,
315,5f2329b00b1bb138c5941544,wind-wall,Wind Wall,"['A wall of strong wind rises from the ground at a point you choose within range. You can make the wall up to 50 feet long, 15 feet high, and 1 foot thick. You can shape the wall in any way you choose so long as it makes one continuous path along the ground. The wall lasts for the duration.', 'When the wall appears, each creature within its area must make a strength saving throw. A creature takes 3d8 bludgeoning damage on a failed save, or half as much damage on a successful one.', ""The strong wind keeps fog, smoke, and other gases at bay. Small or smaller flying creatures or objects can't pass through the wall. Loose, lightweight materials brought into the wall fly upward. Arrows, bolts, and other ordinary projectiles launched at targets behind the wall are deflected upward and automatically miss. (Boulders hurled by giants or siege engines, and similar projectiles, are unaffected.) Creatures in gaseous form can't pass through it.""]",,120 feet,"['V', 'S', 'M']",A tiny fan and a feather of exotic origin.,False,Up to 1 minute,True,1 action,3,,"{'damage_type': {'name': 'Bludgeoning', 'url': '/api/damage-types/bludgeoning'}, 'damage_at_slot_level': {'3': '3d8'}}","{'name': 'Evocation', 'url': '/api/magic-schools/evocation'}","[{'name': 'Druid', 'url': '/api/classes/druid'}, {'name': 'Ranger', 'url': '/api/classes/ranger'}]","[{'name': 'Lore', 'url': '/api/subclasses/lore'}]",/api/spells/wind-wall,"{'dc_type': {'name': 'STR', 'url': '/api/ability-scores/str'}, 'dc_success': 'half'}",,"{'type': 'line', 'size': 50}"
316,5f2329b00b1bb138c5941546,wish,Wish,"['Wish is the mightiest spell a mortal creature can cast. By simply speaking aloud, you can alter the very foundations of reality in accord with your desires.', ""The basic use of this spell is to duplicate any other spell of 8th level or lower. You don't need to meet any requirements in that spell, including costly components. The spell simply takes effect."", 'Alternatively, you can create one of the following effects of your choice:', ""- You create one object of up to 25,000 gp in value that isn't a magic item. The object can be no more than 300 feet in any dimension, and it appears in an unoccupied space you can see on the ground."", '- You allow up to twenty creatures that you can see to regain all hit points, and you end all effects on them described in the greater restoration spell.', '- You grant up to ten creatures that you can see resistance to a damage type you choose.', ""- You grant up to ten creatures you can see immunity to a single spell or other magical effect for 8 hours. For instance, you could make yourself and all your companions immune to a lich's life drain attack."", ""- You undo a single recent event by forcing a reroll of any roll made within the last round (including your last turn). Reality reshapes itself to accommodate the new result. For example, a wish spell could undo an opponent's successful save, a foe's critical hit, or a friend's failed save. You can force the reroll to be made with advantage or disadvantage, and you can choose whether to use the reroll or the original roll."", ""You might be able to achieve something beyond the scope of the above examples. State your wish to the GM as precisely as possible. The GM has great latitude in ruling what occurs in such an instance; the greater the wish, the greater the likelihood that something goes wrong. This spell might simply fail, the effect you desire might only be partly achieved, or you might suffer some unforeseen consequence as a result of how you worded the wish. For example, wishing that a villain were dead might propel you forward in time to a period when that villain is no longer alive, effectively removing you from the game. Similarly, wishing for a legendary magic item or artifact might instantly transport you to the presence of the item's current owner."", ""The stress of casting this spell to produce any effect other than duplicating another spell weakens you. After enduring that stress, each time you cast a spell until you finish a long rest, you take 1d10 necrotic damage per level of that spell. This damage can't be reduced or prevented in any way. In addition, your Strength drops to 3, if it isn't 3 or lower already, for 2d4 days. For each of those days that you spend resting and doing nothing more than light activity, your remaining recovery time decreases by 2 days. Finally, there is a 33 percent chance that you are unable to cast wish ever again if you suffer this stress.""]",,Self,['V'],,False,Instantaneous,False,1 action,9,,,"{'name': 'Conjuration', 'url': '/api/magic-schools/conjuration'}","[{'name': 'Sorcerer', 'url': '/api/classes/sorcerer'}, {'name': 'Wizard', 'url': '/api/classes/wizard'}]",[],/api/spells/wish,,,
317,5f2329b00b1bb138c5941545,word-of-recall,Word of Recall,"['You and up to five willing creatures within 5 feet of you instantly teleport to a previously designated sanctuary. You and any creatures that teleport with you appear in the nearest unoccupied space to the spot you designated when you prepared your sanctuary (see below). If you cast this spell without first preparing a sanctuary, the spell has no effect.', ""You must designate a sanctuary by casting this spell within a location, such as a temple, dedicated to or strongly linked to your deity. If you attempt to cast the spell in this manner in an area that isn't dedicated to your deity, the spell has no effect.""]",,5 feet,['V'],,False,Instantaneous,False,1 action,6,,,"{'name': 'Conjuration', 'url': '/api/magic-schools/conjuration'}","[{'name': 'Cleric', 'url': '/api/classes/cleric'}]",[],/api/spells/word-of-recall,,,"{'type': 'sphere', 'size': 5}"
318,5f2329b00b1bb138c5941547,zone-of-truth,Zone of Truth,"[""You create a magical zone that guards against deception in a 15-foot-radius sphere centered on a point of your choice within range. Until the spell ends, a creature that enters the spell's area for the first time on a turn or starts its turn there must make a Charisma saving throw. On a failed save, a creature can't speak a deliberate lie while in the radius. You know whether each creature succeeds or fails on its saving throw."", 'An affected creature is aware of the fate and can avoid answering questions she would normally have responded with a lie. Such a creature can remain evasive in his answers as they remain within the limits of truth.']",,60 feet,"['V', 'S']",,False,10 minutes,False,1 action,2,,,"{'name': 'Enchantment', 'url': '/api/magic-schools/enchantment'}","[{'name': 'Bard', 'url': '/api/classes/bard'}, {'name': 'Cleric', 'url': '/api/classes/cleric'}, {'name': 'Paladin', 'url': '/api/classes/paladin'}]","[{'name': 'Lore', 'url': '/api/subclasses/lore'}, {'name': 'Devotion', 'url': '/api/subclasses/devotion'}]",/api/spells/zone-of-truth,,,"{'type': 'sphere', 'size': 15}"
